asset_id,character_id,stage,reward_type,file_path,is_placeholder,unlock_condition,title,description,player_reaction,next_dialogue_id
RWD_001,airi,1,image,/assets/rewards/RWD_001_airi_1.jpg,true,puzzle_clear,愛莉のおっぱい,鏡の前でブラジャー外して...Cカップのおっぱい揉んで乳首触る,こっ！コレが愛莉のおっぱいか！！柔らかい...Cカップなのに...こんなに弾力があるなんて！乳首も...ピンク色で...触ると敏感に反応する！！,airi_stage2_1
RWD_002,airi,2,image,/assets/rewards/RWD_002_airi_2.jpg,true,puzzle_clear,パンティを脱いで,白いパンティ脱いで...ピンクのマ◯コ全部見る。綺麗に処理済み♡,パンティの中に手を突っ込んでみようか！！？？うわっ...ツルツル...綺麗に処理されてる！ピンク色のマ◯コが丸見えだ...こんなの見ちゃっていいのか！？,airi_stage3_1
RWD_003,airi,3,video,/assets/rewards/RWD_003_airi_3.mp4,true,puzzle_clear,お風呂で全裸,お風呂で全裸の愛莉...おっぱい揉んで、マ◯コ洗って、感じちゃう,お風呂で濡れたおっぱい...滑る...！マ◯コ洗うと...感じる...！女の子ってこんなに敏感なのか...！触るだけで身体が熱くなる...！,airi_stage4_1
RWD_004,airi,4,video,/assets/rewards/RWD_004_airi_pee.mp4,true,puzzle_clear,愛莉のおしっこ,トイレで...パンティ下ろして座って。恥ずかしいけど...おしっこ出ちゃう♡,トイレでパンティ下ろして...おしっこ出る...！女の子のおしっこってこんな感じなのか...！恥ずかしいけど...なんか興奮する...！,airi_stage5_1
RWD_005,airi,5,video,/assets/rewards/RWD_005_airi_sex.mp4,true,puzzle_clear,愛莉とセックス,ベッドで脚を開いて...マ◯コにチ◯ポ入れて。初めてなのに...気持ちいい...♡,女の子ってイクとこんなに気持ちイイのか！！？？マ◯コにチ◯ポ入れられて...奥まで突かれて...たまらない！もっとイカせてほしい！もっとお◯ん◯んがほしい！,airi_stage6_1
RWD_006,airi,6,video,/assets/rewards/RWD_006_airi_creampie.mp4,true,puzzle_clear,愛莉に中出し,奥まで...イクイク...！中に出して...精子いっぱい...妊娠しちゃう♡,もっと奥までついてほしいっ！！中に出されて...熱いのが流れ込んでくる...！イクイク...！女の子のイキ方...こんなに気持ちいいなんて...！妊娠しちゃう...！,complete
RWD_011,kaho,1,image,/assets/rewards/RWD_011_kaho_1.jpg,true,puzzle_clear,汗だくおっぱい,運動後の汗ばんだDカップ...スポーツブラ脱いで乳首勃起してる,夏帆のDカップ...！汗で濡れてる...！こんなに大きいのか...！乳首も勃起してる...触りたい...揉みたい...！女の子の胸ってこんなに柔らかいんだな...！,kaho_stage2_1
RWD_012,kaho,2,image,/assets/rewards/RWD_012_kaho_2.jpg,true,puzzle_clear,シャワーでマ◯コ,シャワー浴びながらマ◯コ洗う...敏感で気持ちいい♡,パンティ脱いで...マ◯コ洗うと...感じる...！シャワーが当たるだけでビクッて...！女の子ってこんなに敏感なのか...！もっと触りたい...！,kaho_stage3_1
RWD_013,kaho,3,video,/assets/rewards/RWD_013_kaho_3.mp4,true,puzzle_clear,弾けるおっぱい,鏡の前でジャンプ...Dカップが揺れる。マ◯コも触って感じる,ジャンプするとDカップが揺れまくり...！こんな感覚初めて...！マ◯コ触ると...電気が走る...！女の子の身体って気持ちいい...！,kaho_stage4_1
RWD_014,kaho,4,video,/assets/rewards/RWD_014_kaho_pee.mp4,true,puzzle_clear,夏帆のおしっこ,シャワー中に...我慢できなくて。立ったまま...おしっこ垂れ流し♡,立ったままおしっこ...！女の子のおしっこって...垂れ流し...！恥ずかしいのに...なんで興奮するんだ...！もっと出ちゃう...！,kaho_stage5_1
RWD_015,kaho,5,video,/assets/rewards/RWD_015_kaho_sex.mp4,true,puzzle_clear,夏帆とセックス,体育館の倉庫で...マ◯コ濡れ濡れ。激しく突いて...Dカップ揺れる♡,マ◯コに...入ってくる...！激しく突かれて...Dカップ揺れまくり...！女の子ってこんなに気持ちいいのか...！もっと...もっと奥まで...！イキそう...！,kaho_stage6_1
RWD_016,kaho,6,video,/assets/rewards/RWD_016_kaho_creampie.mp4,true,puzzle_clear,夏帆に中出し,もうダメ...イっちゃう...！中に出して...たくさん...あふれてる♡,中に出されて...！熱いのが溢れてくる...！イクイク...！女の子のイキ方...たまらない...！もっと出して...！中出し最高...！,complete
RWD_021,mitsuki,1,image,/assets/rewards/RWD_021_mitsuki_1.jpg,true,puzzle_clear,委員長のおっぱい,制服の下はCカップ...ブラ外して敏感な乳首触る,委員長のおっぱい...！意外と大きい...！Cカップ...ブラ外すと...乳首敏感すぎ...！触るだけで反応する...！クールなのに...エロい身体してる...！,mitsuki_stage2_1
RWD_022,mitsuki,2,image,/assets/rewards/RWD_022_mitsuki_2.jpg,true,puzzle_clear,パンティ脱いで,黒のセクシーパンティ脱ぐ...ツルツルマ◯コ全部見える♡,黒パンティ脱いで...！ツルツルマ◯コ...！綺麗に処理してある...！委員長なのにこんなにエロい...！触って確かめたい...！,mitsuki_stage3_1
RWD_023,mitsuki,3,video,/assets/rewards/RWD_023_mitsuki_3.mp4,true,puzzle_clear,感じやすい身体,鏡でマ◯コ触って...クールな委員長が感じて濡れる,鏡でマ◯コ触ると...濡れてる...！クールな委員長なのに...感じやすい身体...！触るだけでビクビク...！女の子ってこんなに敏感なのか...！,mitsuki_stage4_1
RWD_024,mitsuki,4,video,/assets/rewards/RWD_024_mitsuki_pee.mp4,true,puzzle_clear,美月のおしっこ,委員会室で...我慢してたけど限界。パンティ脱いで...おしっこ噴射♡,委員会室でおしっこ...！我慢してたけど...噴射...！委員長のおしっこ...恥ずかしい...！でも興奮する...！もっと出ちゃう...！,mitsuki_stage5_1
RWD_025,mitsuki,5,video,/assets/rewards/RWD_025_mitsuki_sex.mp4,true,puzzle_clear,美月とセックス,机の上で...脚を開いて。委員長のマ◯コに...チ◯ポ挿入...感じる♡,机の上でセックス...！委員長のマ◯コに...チ◯ポ入れられて...！奥まで突かれて...気持ちいい...！もっと激しく...！イカせて...！,mitsuki_stage6_1
RWD_026,mitsuki,6,video,/assets/rewards/RWD_026_mitsuki_creampie.mp4,true,puzzle_clear,美月に中出し,クールなのに...イキそう...！中に出して...精子で満たされる♡,もっと奥まで...！中出しされて...精子で満たされる...！イクイク...！クールな委員長の身体...こんなに気持ちいいなんて...！妊娠しちゃう...！,complete
RWD_031,misaki,1,image,/assets/rewards/RWD_031_misaki_1.jpg,true,puzzle_clear,先輩の豊満おっぱい,19歳のEカップ...ブラ外すと大きいおっぱいが揺れる,先輩のEカップ...！こんなに大きいのか...！ブラ外すと...揺れる...！19歳のおっぱい...柔らかすぎる...！触りたい...揉みたい...！,misaki_stage2_1
RWD_032,misaki,2,image,/assets/rewards/RWD_032_misaki_2.jpg,true,puzzle_clear,大人のマ◯コ,レースパンティ脱いで...19歳の濡れやすいマ◯コ触る,レースパンティ脱いで...！19歳のマ◯コ...大人の...！濡れやすいって...もう濡れてる...！触るだけでヌルヌル...！先輩エロすぎ...！,misaki_stage3_1
RWD_033,misaki,3,video,/assets/rewards/RWD_033_misaki_3.mp4,true,puzzle_clear,先輩と30分間,ベッドで全裸...おっぱい揉んで、マ◯コ触って、好きにする♡,ベッドで全裸...！おっぱい揉んで...Eカップ柔らかい...！マ◯コ触ると...濡れてる...！30分間先輩を好きにできる...！最高...！,misaki_stage4_1
RWD_034,misaki,4,video,/assets/rewards/RWD_034_misaki_pee.mp4,true,puzzle_clear,美咲のおしっこ,お風呂で...先輩がおしっこするとこ見せてあげる。勢いよく出てる♡,お風呂でおしっこ...！先輩のおしっこ...勢いよく出てる...！大人の女の子のおしっこって...こんな感じなのか...！恥ずかしいけど興奮する...！,misaki_stage5_1
RWD_035,misaki,5,video,/assets/rewards/RWD_035_misaki_sex.mp4,true,puzzle_clear,美咲とセックス,大人の身体で...Eカップが激しく揺れる。マ◯コ濡れすぎ...気持ちいい♡,Eカップが激しく揺れる...！マ◯コ濡れすぎ...！大人の女の子とセックス...気持ちよすぎる...！もっと突いて...！イカせて...！,misaki_stage6_1
RWD_036,misaki,6,video,/assets/rewards/RWD_036_misaki_creampie.mp4,true,puzzle_clear,美咲に中出し,先輩のマ◯コに...たくさん出して...！中出し...溢れるほど注ぎ込んで♡,中出し...！先輩のマ◯コに...溢れるほど注ぎ込まれて...！イクイク...！大人の女の子のイキ方...最高...！妊娠しちゃう...！,complete
